A empresa abona o dia em que eu for doar sangue?,É concedido ao funcionário 01 (um) dia de ausência sem prejuízos a cada doze meses de trabalho mediante atestado de doação voluntária de sangue.
Em um ano quantos dias posso fazer doação de sangue sem prejuízos ou compensação?,É concedido ao funcionário 01 (um) dia de ausência sem prejuízos a cada doze meses de trabalho mediante atestado de doação voluntária de sangue.
A empresa contrata ex-funcionários demitidos por Justa Causa?,Sim por uma única vez e desde que respeitado o intervalo de 180 (cento e oitenta) dias de sua saída. Não recontratamos ex-funcionários que tenham sido desligados na condição de “Justa Causa”.
Caso eu seja demitido e aprimore meu conhecimento técnico posso ser recontratado?,Sim por uma única vez e desde que respeitado o intervalo de 180 (cento e oitenta) dias de sua saída. Não recontratamos ex-funcionários que tenham sido desligados na condição  (...)
O que a empresa reembolsa?,Consulte a Política! Em geral temos: reembolso de transporte coletivo Táxi deslocamentos por quilometragem e de estacionamento utilizando veículo próprio reembolso de viagens e despesas de viagens (passagem área estacionamento al (...)
Em quais casos posso ser reembolsado?,Consulte a Política! Em geral temos: reembolso de transporte coletivo Táxi deslocamentos por quilometragem e de estacionamento utilizando veículo próprio reembolso de viagens e despesas de viagens (passagem área estaci (...)
O que eu faço quando meu reembolso for negado injustamente?,Consulte seu gestor. Se ainda não esclarecido procure o RH que poderá imparcialmente avaliar junto aos responsáveis.
Meu reembolso é válido porém foi negado. Como proceder?,Consulte seu gestor. Se ainda não esclarecido procure o RH que poderá imparcialmente avaliar junto aos responsáveis.
O que faço para trocar o local de trabalho ou projeto?,É uma característica do nosso negócio a recorrente transferência entre locais de trabalho conforme projeto e necessidades do cliente. O processo de adaptação de cada pessoa é diferente e desde que plan (...)
É possível a transferência de equipe caso eu não me adapte?,É uma característica do nosso negócio a recorrente transferência entre locais de trabalho conforme projeto e necessidades do cliente. O processo de adaptação de cada pessoa é diferente e desde que (...)
Qual o significado de PLR?,É Participação nos Lucros e Resultados.
O que significa a sigla PLR?,É Participação nos Lucros e Resultados.
O formulário de Entrevista de Desligamento é confidencial?,Faz parte dos processos da área de RH conduzir uma conversa com o funcionário que formaliza o pedido de demissão ou aqueles que são desligados. O formulário de Entrevista de Desligamento é absoluta (...)
Quem tem acesso à Entrevista de Desligamento?,Faz parte dos processos da área de RH conduzir uma conversa com o funcionário que formaliza o pedido de demissão ou aqueles que são desligados. O formulário de Entrevista de Desligamento é absolutamente confi (...)
É necessário compensar os dias nos quais faço vestibular?,É concedido ao funcionário a autorização de ausência sem prejuízos nos dias que estiver prestando exames de avaliação para ingresso em instituição de ensino superior mediante comprovação.
Pretendo fazer vestibular em breve. Posso faltar na empresa no dia?,É concedido ao funcionário a autorização de ausência sem prejuízos nos dias que estiver prestando exames de avaliação para ingresso em instituição de ensino superior mediante comprovação.
Recebo subsídio para cursos. É necessário comunicar o gestor em alterações de curso/custos?,Sim. Valide sua decisão com seu gestor imediato e com o RH pois a aprovação de subsídio de cursos é aplicada com rigorosa avaliação logo qualquer mudança precisa se (...)
Vou alterar meu curso na faculdade e recebo subsídio. Devo comunicar alguém?,Sim. Valide sua decisão com seu gestor imediato e com o RH pois a aprovação de subsídio de cursos é aplicada com rigorosa avaliação logo qualquer mudança precisa ser comunicada.
O que necessito entregar para solicitar um reembolso?,Para cada tipo de reembolso há exigências específicas que estão descritas na Política de Reembolso. Vale ressaltar que recibos notas fiscais comprovantes e/ou documentos que evidenciem a veracidade da d (...)
Quais as exigências para solicitar um determinado reembolso?,Para cada tipo de reembolso há exigências específicas que estão descritas na Política de Reembolso. Vale ressaltar que recibos notas fiscais comprovantes e/ou documentos que evidenciem a veracida (...)
Por que não tenho acesso aos mesmos benefícios que meu colega?,Asseguramos a todos os benefícios legais aos colaboradores. Pontualmente há cargos ou áreas/setores e convenção sindical com benefícios diferenciados conforme particularidades. Para cada benefí (...)
Por que os benefícios concedidos pela empresa são diferentes para determinados funcionários?,Asseguramos a todos os benefícios legais aos colaboradores. Pontualmente há cargos ou áreas/setores e convenção sindical com benefícios diferenciados conforme part (...)
Terei que compensar o dia se eu for acionado pela Justiça?,A empresa autorizará a ausência do funcionário sem prejuízos em todas as ocasiões que for acionado pela Justiça mediante comprovação.
Caso eu seja acionado pela Justiça posso me ausentar na data?,A empresa autorizará a ausência do funcionário sem prejuízos em todas as ocasiões que for acionado pela Justiça mediante comprovação.
Em feriados a empresa notifica os funcionários em eventuais emendas?,Sim. A empresa sempre encaminha as orientações com antecedência mínima de 1 dia sobre folgas a serem gozadas quando implicar em compensação.
A empresa notifica os empregados caso tenham que compensar emendas de feriados?,Sim. A empresa sempre encaminha as orientações com antecedência mínima de 1 dia sobre folgas a serem gozadas quando implicar em compensação.
Em que dia da semana posso sair de férias?,As férias sempre deverão iniciar às segundas-feiras ou no dia seguinte quando a segunda-feira for um feriado.
Em quais casos posso sair de férias sem ser numa segunda?,As férias sempre deverão iniciar às segundas-feiras ou no dia seguinte quando a segunda-feira for um feriado.
Posso pedir empréstimo à empresa?,Nossa empresa possui parceria com banco onde nossos colaboradores já possuem condições diferenciadas. Consulte diretamente seu gerente bancário.
Pretendo trocar de curso na faculdade porém a mensalidade é maior. O ajuste é feito?,Não. Nossa empresa não aplica ajustes sobre o valor de subsídio aprovado. Sobre realizar a troca de instituição ou cursos/programas comunique seu gestor e RH.
Vou trocar de faculdade em breve mas o valor da mensalidade aumentará. A empresa aumenta o subsídio?,Não. Nossa empresa não aplica ajustes sobre o valor de subsídio aprovado. Sobre realizar a troca de instituição ou cursos/programas comunique seu gestor e  (...)
Onde devo registrar reclamações sobre a limpeza dos banheiros?,As questões de limpeza e higiene dos espaços da sede da MAGNASISTEMAS possui uma coordenação responsável pela qualidade e gestão. Recomendações acionar a coordenação responsável ou o RH que pod (...)
A qualidade de limpeza e higiene dos banheiros está baixa. Já acionei a coordenação responsável e nada mudou. Como proceder?,As questões de limpeza e higiene dos espaços da sede da MAGNASISTEMAS possui uma coordenação responsável pela qualidade e gestão. R (...)
Por que o valor de subsídio para estudo é diferente entre os funcionários?,Cada investimento em apoio à estudos é analisado com alto zelo e rigorosa avaliação logo podem ser diferentes entre os colaboradores do grupo sem que haja conotações de favoreciment (...)
Como funciona a análise de concessão de subsídios para os funcionários já que recebemos valores diferentes?,Cada investimento em apoio à estudos é analisado com alto zelo e rigorosa avaliação logo podem ser diferentes entre os colaboradores do grupo sem qu (...)
Posso incluir meus sobrinhos como dependentes no Plano Médico?,Não há essa opção. O Plano Médico é um benefício exclusivo para os empregados com contrato ativo e respectivo cônjuge/companheiro e/ou dependentes legais.
Posso incluir meus irmãos como dependentes no Plano Médico?,Não há essa opção. O Plano Médico é um benefício exclusivo para os empregados com contrato ativo e respectivo cônjuge/companheiro e/ou dependentes legais.
Quais os benefícios concedidos pela empresa?,Aplicamos os benefícios determinados pela legislação trabalhista e previstos na convecção coletiva da categoria.
A empresa oferece quais benefícios aos funcionários?,Aplicamos os benefícios determinados pela legislação trabalhista e previstos na convecção coletiva da categoria.
Minhas sugestões nunca são ouvidas pelos meus colegas de equipe. Onde posso fazer uma reclamação?,Cada área dentro da companhia possui uma determinada diretoria gerência ou coordenação responsáveis e estão todos muito abertos a sugestões para juntos melhor (...)
Onde posso fazer críticas ou sugestões de melhoria?,Cada área dentro da companhia possui uma determinada diretoria gerência ou coordenação responsáveis e estão todos muito abertos a sugestões para juntos melhorarmos assim como críticas ou questões.
Quando eu acabei minha pós não tive o subsídio convertido em salário diferentemente do meu colega por quê?,Certamente seu colega teve um ajuste salarial em mérito ou promoção. Subsídio para cursos não fazem parte de salários nominais.
Qual o padrão utilizado para converter o subsídio para cursos em salário já que meu colega teve e eu não?,Certamente seu colega teve um ajuste salarial em mérito ou promoção. Subsídio para cursos não fazem parte de salários nominais.
Quais os procedimentos para incluir minha esposa como dependente no Plano Médico?,É necessário a apresentação de uma determinada relação de documentos para a inclusão de dependentes. Consulte o Departamento Pessoal.
O que devo fazer para incluir dependentes no Plano Médico?,É necessário a apresentação de uma determinada relação de documentos para a inclusão de dependentes. Consulte o Departamento Pessoal.
Com quem os ex-funcionários podem esclarecer dúvidas sobre valores de recebimento?,Os ex-funcionários podem esclarecer dúvidas entrando em contato com a área de Departamento Pessoal.
Com quem devo falar caso eu seja demitido e tenha dúvidas sobre o recebimento das verbas rescisórias?,Os ex-funcionários podem esclarecer dúvidas entrando em contato com a área de Departamento Pessoal.
É possível aumentar o valor do meu vale refeição?,Não. A empresa segue padrões e aplica o benefício conforme convenção coletiva local.
Posso solicitar aumento do valor do VR?,Não. A empresa segue padrões e aplica o benefício conforme convenção coletiva local.
Quantos dias são concedidos caso algum familiar faleça?,É concedido ao funcionário 05 (cinco) dias úteis consecutivos de ausência sem prejuízos mediante comprovação somente em caso de falecimento de cônjuge pais filhos irmãos ou dependentes legais.
Quando algum familiar falece quantos dias tenho o direito de ficar em casa?,É concedido ao funcionário 05 (cinco) dias úteis consecutivos de ausência sem prejuízos mediante comprovação somente em caso de falecimento de cônjuge pais filhos irmãos ou depende (...)
Antes de ser demitido posso fazer o backup dos arquivos do computador da empresa?,Nenhum funcionário está autorizado a realizar backup de arquivos dos equipamentos da empresa visto que o equipamento disponibilizado é de uso exclusivo para fins profissionai (...)
Posso fazer o backup dos arquivos pessoais que estão no equipamento da empresa antes de sair?,Nenhum funcionário está autorizado a realizar backup de arquivos dos equipamentos da empresa visto que o equipamento disponibilizado é de uso exclusivo para fins  (...)
Por que não recebi o PLR?,É possível que sua Avaliação Individual de Desempenho não tenha ficado dentro da média para elegibilidade do PLR. Consulte o RH.
Atingi os requisitos necessários para recebimento do PLR por que não recebi o pagamento?,É possível que sua Avaliação Individual de Desempenho não tenha ficado dentro da média para elegibilidade do PLR. Consulte o RH.
Posso indicar parentes para a empresa?,Sim. Desde que comprovadamente o profissional demonstre as competências para o respectivo cargo no processo de seleção pois é avaliado como os demais candidatos da companhia e atuamos para que não ocorra em nenhuma hi (...)
Se eu indicar um parente para a empresa ele pode ser contratado?,Sim. Desde que comprovadamente o profissional demonstre as competências para o respectivo cargo no processo de seleção pois é avaliado como os demais candidatos da companhia e atuamos para qu (...)
O que faço para receber o brinde já que no dia que foi entregue eu não estava presente?,Normalmente é encaminhado ao setor aos cuidados do colaborador ou centralizado com o gestor. Qualquer dúvida procure o RH.
Estava viajando quando a empresa entregou o brinde. Com quem eu falo para receber?,Normalmente é encaminhado ao setor aos cuidados do colaborador ou centralizado com o gestor. Qualquer dúvida procure o RH.
É possível fazer alterações no Plano Médico?,Na admissão o colaborador terá acesso às condições do plano e uma vez optado não poderá fazer alterações ao longo do contrato.
Com quem devo falar para fazer alterações no Plano Médico?,Na admissão o colaborador terá acesso às condições do plano e uma vez optado não poderá fazer alterações ao longo do contrato.
Em quanto tempo recebo pendências identificadas na homologação?,Homologações com ressalvas precisam ser pagas em até 10 (dez) dias corridos a partir da ressalva apontada pelo sindicato.
O sindicato identificou ressalvas na minha homologação. Qual o tempo limite para receber as pendências?,Homologações com ressalvas precisam ser pagas em até 10 (dez) dias corridos a partir da ressalva apontada pelo sindicato.
A empresa auxilia em cirurgias não cobridas pelo Plano Médico?,Nossa empresa não conduz nenhuma alteração tratativas de exceção junto aos acordos de benefícios.
Com quem devo conversar para conseguir auxílio no pagamento de uma cirurgia que o plano não cobre?,Nossa empresa não conduz nenhuma alteração tratativas de exceção junto aos acordos de benefícios.
Tenho direito à licença paternidade se adotar uma criança?,É concedido ao funcionário 05 (cinco) dias úteis consecutivos de ausência na semana do nascimento ou adoção de filho mediante comprovação.
Quantos dias são concedidos na semana de nascimento do meu filho?,É concedido ao funcionário 05 (cinco) dias úteis consecutivos de ausência na semana do nascimento ou adoção de filho mediante comprovação.
Como será feita a avaliação de desempenho sendo que estive em poucos projetos no decorrer do ano?,Seu gestor conduzirá a avaliação com base nos dados que possui. Cabe a ele levantar estes dados.
Estive em poucos projetos no ano. Isso prejudicará a minha avaliação de desempenho?,Seu gestor conduzirá a avaliação com base nos dados que possui. Cabe a ele levantar estes dados.
Em quantos dias após o desligamento receberei os pagamentos pendentes?,A empresa deve efetuar o pagamento das verbas rescisórias em até 10 (dez) dias após efetivação do pedido de desligamento do ex-funcionário.
Qual a data limite para o pagamento das verbas rescisórias do ex-funcionário?,A empresa deve efetuar o pagamento das verbas rescisórias em até 10 (dez) dias após efetivação do pedido de desligamento do ex-funcionário.
A empresa permite estágio não remunerado?,Não realizamos essa modalidade de contratação. Todos os profissionais possuem contrato que pode ser de trabalho ou estágio.
É permitido à um estudante de TI fazer um estágio não remunerado para aprimorar conhecimento?,Não realizamos essa modalidade de contratação. Todos os profissionais possuem contrato que pode ser de trabalho ou estágio.
Com quem faço questionamentos sobre a Avaliação de Desempenho?,A nota final da Avaliação de Desempenho é definida pelo gestor com base na performance do colaborador ao longo do ano. Na reunião de feedback com seu gestor você pode conduzir suas indagações e (...)
Não entendi a minha nota final da Avaliação de Desempenho. Como proceder?,A nota final da Avaliação de Desempenho é definida pelo gestor com base na performance do colaborador ao longo do ano. Na reunião de feedback com seu gestor você pode conduzir suas i (...)
Apontamentos atrasados resultam em advertência?,Sim. O colaborador obrigatoriamente precisa fazer o controle de seu ponto.
Advertências são aplicadas em virtude de apontamentos atrasados?,Sim. O colaborador obrigatoriamente precisa fazer o controle de seu ponto.
É possível receber uma suspensão sem antes ter assinado nenhuma advertência?,Sim. As sanções de Advertência e Suspensão são aplicadas todas as vezes que houver comprovação de falta das práticas contratuais de trabalho ou as respectivas Políticas Manuais e  (...)
Meu gestor pode aplicar uma suspensão sem antes ter aplicado uma advertência?,Sim. As sanções de Advertência e Suspensão são aplicadas todas as vezes que houver comprovação de falta das práticas contratuais de trabalho ou as respectivas Políticas Manuais e (...)
Sou estagiário. Devo solicitar férias no sistema assim como os outros funcionários?,Estagiários possuem contrato de estágio portanto suas condições são diferentes dos colaboradores que possuem contrato de trabalho.
Os estagiários devem solicitar férias no sistema com quantos dias de antecedência?,Estagiários possuem contrato de estágio portanto suas condições são diferentes dos colaboradores que possuem contrato de trabalho.
Quem faz minha avaliação de desempenho: o gestor atual ou o gestor com o qual eu trabalhei durante um período de tempo maior?,O gestor atual é o responsável por concluir a avaliação. Cabe a ele levantar dados sobre sua performance.
Meu gestor atual conduzirá a minha avaliação de desempenho porém meu antigo gestor me conhece mais. Por que ele não pode me avaliar?,O gestor atual é o responsável por concluir a avaliação. Cabe a ele levantar dados sobre sua performance.
É dever da empresa conceder férias ao funcionário?,Sim. É um dever da empresa assegurar esse direito do empregado. É importante e necessário o planejamento das férias.
É obrigatório o período de férias do funcionário?,Sim. É um dever da empresa assegurar esse direito do empregado. É importante e necessário o planejamento das férias.
A empresa aumenta o valor do VT ou então ajuda nas despesas extras de transporte?,Seguimos com rigor a legislação trabalhista e nossa convenção coletiva que preveem a aplicação de VT aos funcionários.
Além do VT quais ajudas de custo relacionadas à transporte existem na empresa?,Seguimos com rigor a legislação trabalhista e nossa convenção coletiva que preveem a aplicação de VT aos funcionários.
Quem tem direito à receber subsídio de pós-graduação?,Nossa empresa já possui parcerias com instituições de ensino onde há boas condições de desconto para colaboradores. A aplicação de subsídios relacionadas à cursos envolve um rigoroso processo de análise (...)
Com quem devo conversar para solicitar subsídio de pós-graduação?,Nossa empresa já possui parcerias com instituições de ensino onde há boas condições de desconto para colaboradores. A aplicação de subsídios relacionadas à cursos envolve um rigoroso process (...)
Após quanto tempo de trabalho o funcionário tem direito às férias?,Após 12 meses completos de trabalho já é possível o direito às férias.
Os funcionários tem direito às férias após quantos meses de trabalho?,Após 12 meses completos de trabalho já é possível o direito às férias.
Além do VT alguma outra ajuda é concedida com relação ao transporte?,Seguimos com rigor a legislação trabalhista e nossa convenção coletiva que preveem a aplicação de Vale Transporte aos funcionários conforme necessidade de deslocamento do endereço residen (...)
A empresa concede o benefício de Vale Transporte ao Funcionário?,Seguimos com rigor a legislação trabalhista e nossa convenção coletiva que preveem a aplicação de Vale Transporte aos funcionários conforme necessidade de deslocamento do endereço residencial (...)
Caso eu seja aprovado posso pedir o reembolso do pagamento da certificação?,A certificação técnica é um compromisso de cada profissional por isso aprovação de subsídios ou reembolso envolve um rigoroso processo de análise junto ao RH e gestores para avalia (...)
A empresa faz o reembolso de certificações aos funcionários?,A certificação técnica é um compromisso de cada profissional por isso aprovação de subsídios ou reembolso envolve um rigoroso processo de análise junto ao RH e gestores para avaliação da elegibil (...)
Existe estabilidade de emprego para o marido da gestante?,Ao funcionário marido ou companheiro de gestante é garantido o emprego a partir do 8º (oitavo) mês de gestação e até 30 (trinta) dias após a data do parto mediante comprovação.
Quantos dias de estabilidade de emprego o marido da gestante tem após o nascimento da criança?,Ao funcionário marido ou companheiro de gestante é garantido o emprego a partir do 8º (oitavo) mês de gestação e até 30 (trinta) dias após a data do parto median (...)
O funcionário pode trabalhar nas férias?,Não é autorizado trabalhar durante o período de férias.
É permitido ao funcionário trabalhar durante as férias?,Não é autorizado trabalhar durante o período de férias.
Posso agendar minhas férias no sistema enquanto estiver no período de licença maternidade e após o término da licença sair de férias?,Toda programação de férias segue a política divulgada pela empresa. É possível gozar de férias a partir do término da lice (...)
É possível emendar o período da licença maternidade com as férias?,Toda programação de férias segue a política divulgada pela empresa. É possível gozar de férias a partir do término da licença maternidade desde que seja previamente planejada e aprovada no  (...)
Jovem Aprendiz tem direito às férias remuneradas?,Sim. O Jovem Aprendiz é um colaborador e possui direito às férias remuneradas.
Férias é um direito do Jovem Aprendiz?,Sim. O Jovem Aprendiz é um colaborador e possui direito às férias remuneradas.
Posso utilizar as horas positivas do meu banco de horas quando eu quiser?,É necessário conversar com seu gestor MAGNASISTEMAS para o respectivo planejamento além de formalização.
Quais os procedimentos para utilizar as horas positivas e descansar um período?,É necessário conversar com seu gestor MAGNASISTEMAS para o respectivo planejamento além de formalização.
Posso fazer adesão ao plano médico da empresa em qualquer momento?,A partir da admissão o colaborador poderá fazer a opção de adesão ao plano médico corporativa em até 30 (trinta) dias sem carência passado esse prazo passará a ter carência.
Após a admissão em quanto tempo posso fazer adesão ao plano médico da empresa?,A partir da admissão o colaborador poderá fazer a opção de adesão ao plano médico corporativa em até 30 (trinta) dias sem carência passado esse prazo passará a ter carência.
Quantos dias sem desconto são concedidos às funcionárias em período de gestação?,É concedido à funcionária gestante a dispensa do horário de trabalho pelo tempo que for necessário para a realização de 09 (nove) consultas médicas e demais exames complementa (...)
Durante o período de gestação todas as horas de consultas médicas exames serão abonadas?,É concedido à funcionária gestante a dispensa do horário de trabalho pelo tempo que for necessário para a realização de 09 (nove) consultas médicas e demais exames com (...)
Posso acumular apontamentos e enviá-los de uma vez?,A apontamento deve ser feito diariamente.
Quantos dias posso atrasar um apontamento?,A apontamento deve ser feito diariamente.
Preciso da aprovação de quem para tirar férias?,Todos os colaboradores precisam da autorização do gestor da área gestor MAGNASISTEMAS para aprovação do período de férias.
Posso tirar férias sem aprovação do cliente?,Todos os colaboradores precisam da autorização do gestor da área gestor MAGNASISTEMAS para aprovação do período de férias.
O que devo fazer para ser promovido?,O processo interno de avaliação de promoção de pessoas é bem minucioso e deve ser conduzido pelo RH em parceira com o gestor. Aproveite sua Avaliação de Desempenho para realizar essa conversa com seu gestor MAGNASISTEMA (...)
Supero todos os requisitos necessários ao meu cargo por que não sou promovido?,O processo interno de avaliação de promoção de pessoas é bem minucioso e deve ser conduzido pelo RH em parceira com o gestor. Aproveite sua Avaliação de Desempenho para realizar (...)
Quais os dias em que a empresa admite os funcionários?,A empresa possui dias específicos para formalizar as contratações consulte o RH.
Os funcionários novos podem ser admitidos em qualquer data?,A empresa possui dias específicos para formalizar as contratações consulte o RH.
